{
  "contract_version": 2,
  "suite": "watch_sync",
  "case_id": "history_invalidation_refetches_cw_and_history",
  "now_ms": 1739923200000,
  "input": {
    "profile_id": "p1",
    "events": [
      { "at_ms": 1739923200000, "type": "surface_visible" },
      { "at_ms": 1739923201000, "type": "connection_opened" },
      { "at_ms": 1739923205000, "type": "invalidation", "profile_id": "p1", "kind": "history" }
    ]
  },
  "expected": {
    "effects": ["open_connection", "refetch_continue_watching", "refetch_home", "refetch_continue_watching", "refetch_history"]
  }
}
