{
  "contract_version": 3,
  "suite": "watch_sync",
  "case_id": "unknown_kind_ignored",
  "now_ms": 1739923200000,
  "input": {
    "profile_id": "p1",
    "events": [
      {
        "at_ms": 1739923200000,
        "type": "surface_visible"
      },
      {
        "at_ms": 1739923201000,
        "type": "connection_opened"
      },
      {
        "at_ms": 1739923205000,
        "type": "invalidation",
        "profile_id": "p1",
        "kind": "future_surface"
      }
    ]
  },
  "expected": {
    "effects": [
      "open_connection",
      "refetch_continue_watching"
    ]
  }
}
