{
  "contract_version": 2,
  "suite": "watch_sync",
  "case_id": "reconnect_on_max_duration",
  "now_ms": 1739923200000,
  "input": {
    "profile_id": "p1",
    "events": [
      { "at_ms": 1739923200000, "type": "surface_visible" },
      { "at_ms": 1739923201000, "type": "connection_opened" },
      { "at_ms": 1739923260000, "type": "max_duration_elapsed" },
      { "at_ms": 1739923261000, "type": "connection_opened" }
    ]
  },
  "expected": {
    "effects": ["open_connection", "refetch_continue_watching", "refetch_home", "close_connection", "open_connection", "refetch_continue_watching", "refetch_home"]
  }
}
